[
  {
    "type": "edition",
    "number_of_pages": 127,
    "title": "Brodie's Notes on Emily Bronte's \"Wuthering Heights\" (Brodies Notes)",
    "latest_revision": 13,
    "authors": [
      {
        "key": "OL1158982A",
        "last_modified": "2008-08-19 18:21:52.259027",
        "name": "Norman T. Carrington",
        "revision": 2,
        "type": "author"
      }
    ],
    "publishers": [
      "Palgrave Macmillan"
    ],
    "key": "OL10551435M",
    "publish_date": "August 7, 1992",
    "subjects": [
      "English literature: literary criticism",
      "Novels, other prose & writers: 19th century",
      "Designed / suitable for A & AS Level",
      "For National Curriculum Key Stage 4 & GCSE",
      "Study guides, home study & revision notes",
      "English",
      "Children: Young Adult (Gr. 7-9)"
    ],
    "revision": 15,
    "last_modified": "2022-11-15T20:13:03.789779"
  },
  {
    "last_modified": "2022-11-15T20:13:03.789779",
    "authors": [
      {
        "key": "OL1158982A",
        "last_modified": "2008-08-19 18:21:52.259027",
        "name": "Norman T. Carrington",
        "revision": 2,
        "type": "author"
      }
    ],
    "title": "Brodie's Notes on Emily Bronte's \"Wuthering Heights\" (Brodies Notes)",
    "subjects": [
      "English literature: literary criticism",
      "Novels, other prose & writers: 19th century",
      "Designed / suitable for A & AS Level",
      "For National Curriculum Key Stage 4 & GCSE",
      "Study guides, home study & revision notes",
      "English",
      "Children: Young Adult (Gr. 7-9)"
    ],
    "publish_date": "August 7, 1992",
    "latest_revision": 13,
    "number_of_pages": 127,
    "type": "edition",
    "publishers": [
      "Palgrave Macmillan"
    ],
    "key": "OL10551435M0",
    "revision": 14
  },
  {
    "last_modified": "2022-11-15T20:13:03.789779",
    "subjects": [
      "English literature: literary criticism",
      "Novels, other prose & writers: 19th century",
      "Designed / suitable for A & AS Level",
      "For National Curriculum Key Stage 4 & GCSE",
      "Study guides, home study & revision notes",
      "English",
      "Children: Young Adult (Gr. 7-9)"
    ],
    "revision": 14,
    "type": "edition",
    "authors": [
      {
        "key": "OL1158982A",
        "last_modified": "2008-08-19 18:21:52.259027",
        "name": "Norman T. Carrington",
        "revision": 2,
        "type": "author"
      }
    ],
    "publishers": [
      "Palgrave Macmillan"
    ],
    "number_of_pages": 127,
    "latest_revision": 13,
    "publish_date": "August 7, 1992",
    "title": "Brodie's Notes on Emily Bronte's \"Wuthering Heights\" (Brodies Notes)",
    "key": "OL10551435M012"
  },
  {
    "title": "Aristophanes, ein Spiegel unserer Zeit.",
    "authors": [
      {
        "key": "OL4473583A",
        "revision": 1,
        "type": "author",
        "name": "A. B Kneisel",
        "last_modified": "2008-09-02 18:39:32.675717"
      }
    ],
    "latest_revision": 3,
    "last_modified": "2010-04-13T09:56:10.635564",
    "type": "edition",
    "key": "OL13994901M",
    "publishers": [
      "P. Schettlers"
    ],
    "subjects": [
      "Aristophanes"
    ],
    "number_of_pages": 78,
    "publish_date": "1913",
    "revision": 3
  },
  {
    "number_of_pages": 192,
    "publish_date": "1993",
    "subjects": [
      "World War, 1939-1945 -- Campaigns -- Europe.",
      "World War, 1939-1945 -- Campaigns -- Europe -- Pictorial works."
    ],
    "title": "War in Europe",
    "type": "edition",
    "key": "OL1413776M",
    "authors": [
      {
        "revision": 2,
        "type": "author",
        "name": "Sidney C. Moody",
        "key": "OL581008A",
        "last_modified": "2008-08-30 03:01:23.375753"
      }
    ],
    "last_modified": "2022-12-05T06:01:35.024861",
    "publishers": [
      "Presidio"
    ],
    "latest_revision": 10,
    "revision": 10
  },
  {
    "publishers": [
      "Times Printing Company"
    ],
    "title": "Muskoka sketch",
    "last_modified": "2012-08-08T21:10:59.924864",
    "latest_revision": 5,
    "authors": [
      {
        "type": "author",
        "last_modified": "2008-09-28 21:35:54.283711",
        "name": "W. E. Hamilton",
        "revision": 1,
        "key": "OL5295787A"
      }
    ],
    "subjects": [
      "Muskoka (Ont. : District) -- Description and travel.",
      "Muskoka (Ont. : District) -- History."
    ],
    "publish_date": "1983",
    "type": "edition",
    "number_of_pages": 26,
    "revision": 5,
    "key": "OL21357082M"
  },
  {
    "last_modified": "2012-08-07T10:18:24.946860",
    "publishers": [
      "Printed by H. Colbert"
    ],
    "key": "OL22885087M",
    "number_of_pages": 200,
    "latest_revision": 3,
    "revision": 3,
    "authors": [
      {
        "type": "author",
        "key": "OL2555401A",
        "last_modified": "2012-06-07T08:18:43.478466",
        "name": "Walker, John",
        "revision": 2
      }
    ],
    "type": "edition",
    "subjects": [
      "Methodists -- Ireland."
    ],
    "publish_date": "1803",
    "title": "A Letter to Alexander Knox, Esq. M.R.I.A."
  },
  {
    "key": "OL25465456M",
    "publishers": [
      "L.J. Demers"
    ],
    "publish_date": "1880",
    "authors": [
      {
        "type": "author",
        "revision": 1,
        "name": "L. N. Carrier",
        "last_modified": "2008-09-28 19:19:44.680177",
        "key": "OL5288239A"
      }
    ],
    "latest_revision": 2,
    "title": "Les Institutions de credit-foncier. Quelques notes sur leur but, leur organisation et leur origine",
    "type": "edition",
    "last_modified": "2020-05-21T10:17:30.189173",
    "number_of_pages": 48,
    "revision": 2,
    "subjects": [
      "Credit",
      "Banks and banking"
    ]
  },
  {
    "key": "OL26545029M",
    "revision": 3,
    "number_of_pages": 298,
    "last_modified": "2020-05-15T03:58:15.877548",
    "type": "edition",
    "publishers": [
      "Biblica, Publications de Saint André"
    ],
    "latest_revision": 3,
    "publish_date": "1965",
    "title": "Psaumes et prière chrétienne",
    "subjects": [
      "Criticism, interpretation",
      "Bible"
    ],
    "authors": [
      {
        "name": "Rose, A.",
        "type": "author",
        "revision": 1,
        "last_modified": "2008-04-01 03:28:50.625462",
        "key": "OL2153880A"
      }
    ]
  },
  {
    "number_of_pages": 331,
    "subjects": [
      "Home video systems.",
      "Video tape recorders.",
      "Camcorders.",
      "Television -- Equipment and supplies."
    ],
    "latest_revision": 10,
    "title": "VCRs & camcorders for dummies",
    "key": "OL824543M",
    "publish_date": "1995",
    "authors": [
      {
        "last_modified": "2008-09-12 15:59:54.226722",
        "type": "author",
        "name": "Gordon McComb",
        "key": "OL51749A",
        "revision": 2
      }
    ],
    "publishers": [
      "IDG Books Worldwide"
    ],
    "type": "edition",
    "last_modified": "2020-11-20T15:58:35.964496",
    "revision": 10
  },
  {
    "key": "OL904472M",
    "publishers": [
      "New Island Books",
      "Nick Hern Books"
    ],
    "revision": 6,
    "type": "edition",
    "number_of_pages": 48,
    "publish_date": "1995",
    "last_modified": "2020-11-21T08:24:06.596410",
    "latest_revision": 6,
    "title": "A night in November",
    "authors": [
      {
        "last_modified": "2008-08-31 21:11:02.340397",
        "name": "Marie Jones",
        "key": "OL500580A",
        "type": "author",
        "revision": 2
      }
    ],
    "subjects": [
      "Protestants -- Northern Ireland -- Belfast -- Drama.",
      "Soccer -- Northern Ireland -- Belfast -- Drama."
    ]
  },
  {
    "latest_revision": 5,
    "key": "OL9921201M",
    "publishers": [
      "Collins"
    ],
    "authors": [
      {
        "type": "author",
        "key": "OL2802829A",
        "name": "Lorna Read",
        "last_modified": "2008-04-29 15:03:11.581851",
        "revision": 1
      }
    ],
    "publish_date": "November 3, 1997",
    "subjects": [
      "Fiction"
    ],
    "title": "The Sleepover Girls Go Spice.... (The Sleepover Club)",
    "type": "edition",
    "revision": 5,
    "last_modified": "2022-12-17T03:01:10.857196",
    "number_of_pages": 96
  }
]